{
  "$schema": "https://json-schema.org/draft/2020-12/schema",
  "$id": "orchestra.protocol.v1.workspace.migrate.response",
  "title": "Orchestra Workspace Migration Response",
  "type": "object",
  "required": ["from", "to", "dry_run", "result"],
  "properties": {
    "from": { "type": "string" },
    "to": { "type": "string" },
    "dry_run": { "type": "boolean" },
    "result": {
      "type": "object",
      "required": ["applied", "actions"],
      "properties": {
        "applied": { "type": "boolean" },
        "actions": {
          "type": "array",
          "items": {
            "type": "object",
            "required": ["type", "source", "target"],
            "properties": {
              "type": { "type": "string" },
              "source": { "type": "string" },
              "target": { "type": "string" },
              "note": { "type": "string" }
            },
            "additionalProperties": true
          }
        }
      },
      "additionalProperties": true
    }
  },
  "additionalProperties": true
}
